Date,Day of the Week,Amount,Description,Financial goals and Savings,Method of Payment,Need/Want/Saving
1/15/25,Thursday,15.77,Morning Breakfast,Food,Debit,Need
1/15/25,Thursday,14.70,Drink for girlfriend and me,Food,Debit,Want
1/15/25,Thursday,11.50,Lunch ,Food,Debit,Need
1/15/25,Thursday,14.27,Drinks for my mom because she is sick,Food,Debit,Need
1/19/25,Sunday,10.75,My lunch for work,Food,Debit,Need
1/19/25,Sunday,98.22,Lunch and dinner for me and my mom,Food,Debit,Need
1/19/25,Sunday,59.32,Dog food for my dog,Food,Debit,Need